key,host,payload
clueweb12-0000tw-00-00040,dailyreporter.info," Featured NewsLocal Mortgage Lender Says National Settlement Won't Go Far Or Fast Enough - KUHF-FM February 10, 2012Mortgage Settlement Just the Start of Trouble for Bank of America (NYSE: BAC ... - Money Morning February 10, 2012Miss. getting $47.1 million from bank settlement - CBS News February 10, 2012Tennessee to Receive $146 Million From Nationwide Mortgage Settlement - LoanSafe February 10, 2012Iowa's take of mortgage settlement: $40 million - DesMoinesRegister.com February 10, 2012$25 Billion Mortgage Agreement Doesn't Let Lenders Off Hook - BusinessWeek February 10, 2012 In The SpotlightLocal Mortgage Lender Says National Settlement Won't Go Far Or Fast Enough - KUHF-FM February 10, 2012Mortgage Settlement Just the Start of Trouble for Bank of America (NYSE: BAC ... - Money Morning February 10, 2012Miss. getting $47.1 million from bank settlement - CBS News February 10, 2012Tennessee to Receive $146 Million From Nationwide Mortgage Settlement - LoanSafe February 10, 2012Iowa's take of mortgage settlement: $40 million - DesMoinesRegister.com February 10, 2012$25 Billion Mortgage Agreement Doesn't Let Lenders Off Hook - BusinessWeek February 10, 2012Utah gets $171M in national mortgage settlement - CBS News February 10, 2012Lenders to pay homeowners in nationwide settlement - Orlando Sentinel February 10, 2012States and lenders reach settlement on foreclosure abuses - Rapid City Journal February 10, 2012Loan Terms Made to Order - New York Times February 9, 2012    "
clueweb12-0000tw-00-00040,dailyreporter.info,"If you think that because you are a good driver your insurance rates will be the lowest, then think again. Although being a good driver is something that will lower your rates, it is not the only factor used by insurance companies when setting their rates."
clueweb12-0000tw-00-00040,dailyreporter.info,Insurance companies have number crunchers and underwriters that look at a lot of things when setting their rates. Their job is to spread their risk as much as possibleCONTINUED
clueweb12-0000tw-00-00040,dailyreporter.info,"Report: Donations Given To Phantom Company By Wyclef Jean's CharityCinema BlendOn January 12th, 2010, an earthquake devastated Haiti, killing many and further impoverishing the nation. A slew of donations poured in to help the relief effort, nearly sixteen million dollars to the Wyclef Jean-run charity Yele alone. Wyclef Jean defends Haiti charity's actionsMiamiHerald.comQuestions Raised Over Allotment of Wyclef Jean's Haiti FundFox NewsWyclef Jean Defends Charity in Wake of Questionable Spending ReportHollywood ReporterReuters-Washington Postall 131 news articles"
clueweb12-0000tw-00-00040,dailyreporter.info,Your email address will not be published. Required fields are marked *Name *
clueweb12-0000tw-00-00040,dailyreporter.info," Trending TopicsThe Arrowhead: Student Loans Becoming More of a Hassle? - my.hsj.org February 10, 2012Fitch Publishes Fourth Quarter 2011 Edition of the Student Loan Report Card - MarketWatch (press release) February 10, 2012Student Loan Grace Period Over: Now What? - Fox Business February 10, 2012Student Loans chief's tax deal 'was approved by top civil servant' - The Guardian February 10, 2012SF Indie Fest - Default: The Student Loan Documentary - Beyond Chron February 10, 2012Student loan debt: Next big bubble to burst - ABC30.com February 10, 2012Obama looks to up student loans - Twin Cities Planet February 10, 2012Class Notes: Science Fairs, Student Loans and More Education News - TIME February 9, 2012S&P says student loan debt could be next financial bubble - Los Angeles Times February 9, 2012Interest rates for common student loan could double this summer - Ball State Daily News February 9, 2012    "
clueweb12-0000tw-00-00040,dailyreporter.info,    Copyright  2012 dailyreporter.info. All Rights Reserved.
clueweb12-0000tw-00-00040,dailyreporter.info,    Magazine Basic theme designed by Themes by bavotasan.com.
clueweb12-0000tw-00-00040,dailyreporter.info,    Powered by WordPress.
clueweb12-0000tw-00-00041,dailyreporter.info," Featured NewsLocal Mortgage Lender Says National Settlement Won't Go Far Or Fast Enough - KUHF-FM February 10, 2012Mortgage Settlement Just the Start of Trouble for Bank of America (NYSE: BAC ... - Money Morning February 10, 2012Miss. getting $47.1 million from bank settlement - CBS News February 10, 2012Tennessee to Receive $146 Million From Nationwide Mortgage Settlement - LoanSafe February 10, 2012Iowa's take of mortgage settlement: $40 million - DesMoinesRegister.com February 10, 2012$25 Billion Mortgage Agreement Doesn't Let Lenders Off Hook - BusinessWeek February 10, 2012 In The SpotlightLocal Mortgage Lender Says National Settlement Won't Go Far Or Fast Enough - KUHF-FM February 10, 2012Mortgage Settlement Just the Start of Trouble for Bank of America (NYSE: BAC ... - Money Morning February 10, 2012Miss. getting $47.1 million from bank settlement - CBS News February 10, 2012Tennessee to Receive $146 Million From Nationwide Mortgage Settlement - LoanSafe February 10, 2012Iowa's take of mortgage settlement: $40 million - DesMoinesRegister.com February 10, 2012$25 Billion Mortgage Agreement Doesn't Let Lenders Off Hook - BusinessWeek February 10, 2012Utah gets $171M in national mortgage settlement - CBS News February 10, 2012Lenders to pay homeowners in nationwide settlement - Orlando Sentinel February 10, 2012States and lenders reach settlement on foreclosure abuses - Rapid City Journal February 10, 2012Loan Terms Made to Order - New York Times February 9, 2012    "
clueweb12-0000tw-00-00041,dailyreporter.info,"If you think that because you are a good driver your insurance rates will be the lowest, then think again. Although being a good driver is something that will lower your rates, it is not the only factor used by insurance companies when setting their rates."
clueweb12-0000tw-00-00041,dailyreporter.info,Insurance companies have number crunchers and underwriters that look at a lot of things when setting their rates. Their job is to spread their risk as much as possibleCONTINUED
clueweb12-0000tw-00-00041,dailyreporter.info,"Search for missing sailors to resumeIrish TimesThe search for five Russian seamen who are missing in the Irish Sea will resume this morning. Their cargo ship sank in gale-force winds some 20 miles south of Holyhead, Wales, early yesterday. Two of eight crew on board the MV Swanland were rescued by One crewman recovered, five missing in sinking off north WalesBBC NewsNew search for five missing seamenThe Press AssociationUK Prince William joins Irish Sea rescue mission of the Russian crew missingeTaiwan NewsTelegraph.co.uk-The Guardian-Sydney Morning Heraldall 1,098 news articles"
clueweb12-0000tw-00-00041,dailyreporter.info,Your email address will not be published. Required fields are marked *Name *
clueweb12-0000tw-00-00041,dailyreporter.info," Trending TopicsThe Arrowhead: Student Loans Becoming More of a Hassle? - my.hsj.org February 10, 2012Fitch Publishes Fourth Quarter 2011 Edition of the Student Loan Report Card - MarketWatch (press release) February 10, 2012Student Loan Grace Period Over: Now What? - Fox Business February 10, 2012Student Loans chief's tax deal 'was approved by top civil servant' - The Guardian February 10, 2012SF Indie Fest - Default: The Student Loan Documentary - Beyond Chron February 10, 2012Student loan debt: Next big bubble to burst - ABC30.com February 10, 2012Obama looks to up student loans - Twin Cities Planet February 10, 2012Class Notes: Science Fairs, Student Loans and More Education News - TIME February 9, 2012S&P says student loan debt could be next financial bubble - Los Angeles Times February 9, 2012Interest rates for common student loan could double this summer - Ball State Daily News February 9, 2012    "
clueweb12-0000tw-00-00041,dailyreporter.info,    Copyright  2012 dailyreporter.info. All Rights Reserved.
clueweb12-0000tw-00-00041,dailyreporter.info,    Magazine Basic theme designed by Themes by bavotasan.com.
clueweb12-0000tw-00-00041,dailyreporter.info,    Powered by WordPress.
clueweb12-0000tw-00-00043,earn4invite.com,online advertising company. Earn4invite.com is 
clueweb12-0000tw-00-00043,earn4invite.com,"twitter, chat rooms and other media."
clueweb12-0000tw-00-00043,earn4invite.com,will open your link.
clueweb12-0000tw-00-00043,earn4invite.com,Updating..... 
clueweb12-0000tw-00-00044,earn4invite.com,online advertising company. Earn4invite.com is 
clueweb12-0000tw-00-00044,earn4invite.com,"twitter, chat rooms and other media."
clueweb12-0000tw-00-00045,fatalerrornetwork.com,        Welcome Guest ! Please Login or Register
clueweb12-0000tw-00-00045,fatalerrornetwork.com,"    Loading player, please wait...."
clueweb12-0000tw-00-00045,fatalerrornetwork.com,This content requires JavaScript and Macromedia Flash Player 7 or higher. Get Flash
clueweb12-0000tw-00-00045,fatalerrornetwork.com,    My Favorite!
clueweb12-0000tw-00-00045,fatalerrornetwork.com,"<iframe width=""300"" height=""250"" src=""http://fatalerrornetwork.com/player/embed_player.php?vid=2029&width=300&height=250&autoplay=yes"" frameborder=""0"" allowfullscreen></iframe>"
clueweb12-0000tw-00-00045,fatalerrornetwork.com,"    Please select the category that most closely reflects your concern about the video, so that we can review it and determine whether it violates our Community Guidelines or isn't appropriate for all viewers. Abusing this feature is also a violation of the Community Guidelines, so don't do it. "
clueweb12-0000tw-00-00045,fatalerrornetwork.com,         mirrored for Shredder FUCK YOU JDUBS!
clueweb12-0000tw-00-00045,fatalerrornetwork.com,Original was uploaded on http://www.youtube.com/ShredderLivesOn (who now has a two week suspension thanks to this flag). Please sub to his backup...More        
clueweb12-0000tw-00-00045,fatalerrornetwork.com,         mirrored for Shredder FUCK YOU JDUBS!
clueweb12-0000tw-00-00045,fatalerrornetwork.com,Original was uploaded on http://www.youtube.com/ShredderLivesOn (who now has a two week suspension thanks to this flag). Please sub to his backup channel http://www.youtube.com/CurseOfShredder Less
clueweb12-0000tw-00-00045,fatalerrornetwork.com,    Elliots friend...
clueweb12-0000tw-00-00045,fatalerrornetwork.com,    Cassius elliot brown time...
clueweb12-0000tw-00-00045,fatalerrornetwork.com,    apology for...
clueweb12-0000tw-00-00045,fatalerrornetwork.com,    WARNING ELLIOT - The Window...
clueweb12-0000tw-00-00045,fatalerrornetwork.com,    PljearnOrder aka Cassius...
clueweb12-0000tw-00-00046,centralalbertatv.net,        Welcome Guest! ( Register  User Login )
clueweb12-0000tw-00-00046,centralalbertatv.net,"Central Alberta TV Live - A new way to watch tv, your tv!"
clueweb12-0000tw-00-00046,centralalbertatv.net,"If you have troubles playing the live stream, remember to click the yellow info bar at the top of the page and allow the content to be viewed on this page. Note: On Internet Explorer 9, the info bar is at the bottom of the page. This setting is only for Internet Explorer."
clueweb12-0000tw-00-00046,centralalbertatv.net,All other web browsers such as FireFox and Safari may require 3rd party plugins to view streaming windows media video. We recommend FireFox for the best security and compatibility. The WMV plugin for FireFox can be downloaded by clicking HERE.
clueweb12-0000tw-00-00046,centralalbertatv.net,"MAC users may need to install a plugin called Flip4Mac, which will enable Windows Media content on your MAC operating system. It may be obtained HERE."
clueweb12-0000tw-00-00046,centralalbertatv.net,"Although we make it our best effort to balance quality vs. streaming performance, some Internet Service Providers only allow a 4-10 MB burst speed, after which they ""throttle"" your speed down. Speed test sites may show you a ""3.0 mbps"" data transfer rate (for example), but they only test the first 4 MB (signifigantly smaller than any video content), and as a result anything larger than that my slow down to as low as ""0.50 mbps"" which is too slow for streaming video. We are not able to guarantee your ISP is able to provide sufficient speed to properly stream video, however if you are experiencing buffering issues, please contact your ISP to see if your internet package supports real time streaming or if they are able to adjust your overall download rates to support it. We are sorry for any inconvenience that is a result of your ISP's bandwidth policies."
clueweb12-0000tw-00-00047,homemakersdaily.com,"Believe It Or Not, You Can Shred Chicken in your Kitchen-Aid! "
clueweb12-0000tw-00-00047,homemakersdaily.com,This recipe is another family favorite that I make often. Its pretty easy and comes together quickly. Serve with salad and garlic bread and you have a delicious meal in a
clueweb12-0000tw-00-00047,homemakersdaily.com,minimal amount of time.
clueweb12-0000tw-00-00047,homemakersdaily.com, c. seasoned bread crumbs (I use the Italian seasoned bread crumbs)
clueweb12-0000tw-00-00047,homemakersdaily.com, cup shredded mozzarella (2 oz.) (I dont know if I use 2 oz.  I just add as much as I think looks good)
clueweb12-0000tw-00-00047,homemakersdaily.com,"Using palm of hand, flatten chicken to even thickness. Dip chicken in egg, then in crumbs to coat. In skillet over medium heat, in hot margarine, brown chicken on both sides. Add Prego sauce. Reduce heat. Cover, simmer 10 minutes. Sprinkle with cheese and parsley."
clueweb12-0000tw-00-00047,homemakersdaily.com,Cover. Simmer five minutes or until cheese melts. Serve over cooked spaghetti.
clueweb12-0000tw-00-00047,homemakersdaily.com,"This entry was posted in Recipes and tagged Chicken, dinner, Mozzarella, pasta, quick dinner recipe, recipe. Bookmark the permalink."
clueweb12-0000tw-00-00047,homemakersdaily.com,"Believe It Or Not, You Can Shred Chicken in your Kitchen-Aid! "
clueweb12-0000tw-00-00047,homemakersdaily.com,Your email address will not be published. Required fields are marked *Name *
clueweb12-0000tw-00-00047,homemakersdaily.com,Where Are My Keys???
clueweb12-0000tw-00-00047,homemakersdaily.com,Aluminum Foil Frustration No More!
clueweb12-0000tw-00-00047,homemakersdaily.com,Appliances:  Use With Caution!
clueweb12-0000tw-00-00047,homemakersdaily.com,Whats For Dinner?
clueweb12-0000tw-00-00047,homemakersdaily.com,Proudly powered by WordPress.
clueweb12-0000tw-00-00048,homemakersdaily.com,Warehouse Shopping: Cost Effective or Costly? 
clueweb12-0000tw-00-00048,homemakersdaily.com,"Believe It Or Not, You Can Shred Chicken in your Kitchen-Aid!"
clueweb12-0000tw-00-00048,homemakersdaily.com,"Ive talked about this before, the miraculous discovery that my kitchen-aid paddle attachment will shred chicken. No more forks and aching hands. Throw it in,chop it up and youre done!"
clueweb12-0000tw-00-00048,homemakersdaily.com,Boil the chicken. Remove from pan and place on cutting board.
clueweb12-0000tw-00-00048,homemakersdaily.com,Cut chicken breasts into halves. I dont know if you absolutely have to do this but I did.
clueweb12-0000tw-00-00048,homemakersdaily.com,Put the chicken in the kitchen-aid bowl with the paddle attachment.
clueweb12-0000tw-00-00048,homemakersdaily.com,"Processthe chicken for about 45 seconds on low speed. And there you have it  beautifully shredded chicken in a fraction of the time it takes with two forks. If I hadnt seen it with my own eyes, I wouldnt have believed it."
clueweb12-0000tw-00-00048,homemakersdaily.com,I have a friend who has a stand-up mixer that isnt a Kitchen-Aid. Her mixer has two beaters instead of one paddle. She tried shredding her chicken with her mixer and it worked just fine.
clueweb12-0000tw-00-00048,homemakersdaily.com,"So next time you need shredded chicken, skip the forks and use your Kitchen-Aid. Its a miracle!!!"
clueweb12-0000tw-00-00048,homemakersdaily.com,"This entry was posted in Cooking and tagged Chicken, Cooking techniques, Kitchen-Aid. Bookmark the permalink."
clueweb12-0000tw-00-00048,homemakersdaily.com,Warehouse Shopping: Cost Effective or Costly? 
clueweb12-0000tw-00-00048,homemakersdaily.com,"2 Responses to Believe It Or Not, You Can Shred Chicken in your Kitchen-Aid!"
clueweb12-0000tw-00-00048,homemakersdaily.com,Your email address will not be published. Required fields are marked *Name *
clueweb12-0000tw-00-00048,homemakersdaily.com,Where Are My Keys???
clueweb12-0000tw-00-00048,homemakersdaily.com,Aluminum Foil Frustration No More!
clueweb12-0000tw-00-00048,homemakersdaily.com,Appliances:  Use With Caution!
clueweb12-0000tw-00-00048,homemakersdaily.com,Whats For Dinner?
clueweb12-0000tw-00-00048,homemakersdaily.com,Proudly powered by WordPress.
clueweb12-0000tw-00-00049,homemakersdaily.com,Can you imagine foods without any herbs or spices? Not a pleasant thought at all. Herbs and spices make our food taste delicious.
clueweb12-0000tw-00-00049,homemakersdaily.com,"Its fun to experiment with different combinations and sometimes our experiments work and sometimes they dont. So in order to increase our chances for success as we experiment, Ive created a chart listing many of the common herbs and spices and how they can be used. I also included at the end of the chart some other specialty spices I have in my collection and where you can get more information about them."
clueweb12-0000tw-00-00049,homemakersdaily.com,"My personal favorite is Chef Paul Prudhommes Herbal Pizza & Pasta Magic. I use this spice every time I make pizza. In fact, I sprinkle it on the dough and skip the sauce."
clueweb12-0000tw-00-00049,homemakersdaily.com,"Itsdelicious! My daughter and daughter-in-law use the spice in addition to their sauce. However you use it, its awesome!"
clueweb12-0000tw-00-00049,homemakersdaily.com,"Now, before you take a look at the chart, here are a few interesting facts I discovered while I was doing research."
clueweb12-0000tw-00-00049,homemakersdaily.com,Mix ingredients in a blender for 20 seconds; store in a tightly covered container.
clueweb12-0000tw-00-00049,homemakersdaily.com,"The difference between black pepper and white pepper is that black pepper is ground peppercorns (the dried berries of the pepper vine) and white pepper is ground from ripened berries of the pepper vine before theyre dried but after the husks have been removed. White pepper is slightly less spicy than black pepper. Its used to season bland, light colored foods such as eggs, cream soups and sauces  dishes which might not look so appetizing with specks of black pepper."
clueweb12-0000tw-00-00049,homemakersdaily.com,"The difference between red pepper and paprika is that red pepper, also called cayenne pepper, is ground from dried chili peppers and is pungent and hot while paprika is ground from certain varieties of sweet red peppers and has a sweet flavor although it may be quite hot."
clueweb12-0000tw-00-00049,homemakersdaily.com,Dried herbs have a stronger flavor if you crush them between your fingers before adding them to food.
clueweb12-0000tw-00-00049,homemakersdaily.com,"Herbs and spices are not the same. Herbs are leafy, green plant parts used for flavoring or as a garnish. Spices are dried seeds, fruits, roots, barks or vegetative substances used in small amounts as food additives for flavor, color or preservatives."
clueweb12-0000tw-00-00049,homemakersdaily.com,"This entry was posted in Cooking and tagged herbs, spices. Bookmark the permalink."
clueweb12-0000tw-00-00049,homemakersdaily.com,Your email address will not be published. Required fields are marked *Name *
clueweb12-0000tw-00-00049,homemakersdaily.com,Where Are My Keys???
clueweb12-0000tw-00-00049,homemakersdaily.com,Aluminum Foil Frustration No More!
clueweb12-0000tw-00-00049,homemakersdaily.com,Appliances:  Use With Caution!
clueweb12-0000tw-00-00049,homemakersdaily.com,Whats For Dinner?
clueweb12-0000tw-00-00049,homemakersdaily.com,Proudly powered by WordPress.
clueweb12-0000tw-00-00050,homemakersdaily.com, Warehouse Shopping: Cost Effective or Costly?
clueweb12-0000tw-00-00050,homemakersdaily.com,This is a really good recipe  one of my favorites  but it does take a little time. Its not hard  the steak just has to cook for a while.
clueweb12-0000tw-00-00050,homemakersdaily.com,"That being said, I made this once in the crock pot and it turned out just as good. Ill provide crock pot directions at the end in case you want to try it that way."
clueweb12-0000tw-00-00050,homemakersdaily.com,3 tbsp. flour
clueweb12-0000tw-00-00050,homemakersdaily.com,1-1/2 tsp. salt
clueweb12-0000tw-00-00050,homemakersdaily.com,2 to 4 tsp. basil leaves
clueweb12-0000tw-00-00050,homemakersdaily.com,1/8 tsp. pepper
clueweb12-0000tw-00-00050,homemakersdaily.com, c. chopped onions
clueweb12-0000tw-00-00050,homemakersdaily.com," c. green pepper, diced (I use the whole green pepper)"
clueweb12-0000tw-00-00050,homemakersdaily.com,"Cut meat in serving-sized pieces. Coat with flour. In a large covered skillet, melt the"
clueweb12-0000tw-00-00050,homemakersdaily.com,margarine and brown meat slowly on both sides.
clueweb12-0000tw-00-00050,homemakersdaily.com,"Add tomatoes, salt, basil and pepper. Cover and simmer one hour."
clueweb12-0000tw-00-00050,homemakersdaily.com,Add onions and green pepper. Cook 30 more minutes or until meat is tender. Top meat with cheese. Heat until cheese melts.
clueweb12-0000tw-00-00050,homemakersdaily.com,You can either brown the meat in the skillet or skip that step  its up to you. Either way works. I did not brown my meat in the skillet. In my opinion that eliminates some of the
clueweb12-0000tw-00-00050,homemakersdaily.com,benefit of the crock pot. I just want to throw everything in and be done with it.
clueweb12-0000tw-00-00050,homemakersdaily.com,"Grease your crock pot with pam. Mix the tomatoes, salt, basil, pepper, onions and green pepper together."
clueweb12-0000tw-00-00050,homemakersdaily.com,Cover and cook on low for 6 to 8 hours. Serve with a bowl of mozzarella cheese to put
clueweb12-0000tw-00-00050,homemakersdaily.com,on top of steak.
clueweb12-0000tw-00-00050,homemakersdaily.com,"This entry was posted in Recipes and tagged beef, crock pot, dinner, Mozzarella, recipe, round steak. Bookmark the permalink."
clueweb12-0000tw-00-00050,homemakersdaily.com, Warehouse Shopping: Cost Effective or Costly?
clueweb12-0000tw-00-00050,homemakersdaily.com,Your email address will not be published. Required fields are marked *Name *
clueweb12-0000tw-00-00050,homemakersdaily.com,Where Are My Keys???
clueweb12-0000tw-00-00050,homemakersdaily.com,Aluminum Foil Frustration No More!
clueweb12-0000tw-00-00050,homemakersdaily.com,Appliances:  Use With Caution!
clueweb12-0000tw-00-00050,homemakersdaily.com,Whats For Dinner?
clueweb12-0000tw-00-00050,homemakersdaily.com,Proudly powered by WordPress.
clueweb12-0000tw-00-00051,homemakersdaily.com," Believe It Or Not, You Can Shred Chicken in your Kitchen-Aid!"
clueweb12-0000tw-00-00051,homemakersdaily.com,Warehouse Shopping: Cost Effective or Costly?
clueweb12-0000tw-00-00051,homemakersdaily.com,"Warehouse shopping, such as at Costco and Sams, can be a great way to save money but it can also lead to the destruction of a good grocery budget. It all depends on how you shop there. First, lets look at the cost and benefits of a membership."
clueweb12-0000tw-00-00051,homemakersdaily.com,"A membership to Sams costs $40 or $100 per year depending on the type of membership you chose. The Advantage membership is $40 and allows for 2 cardholders and the ability to purchase products in-store and online. The Advantage Plus is $100 and allows for 2 card holders, extended shopping hours, extra coupons and a percentage of savings on generic and name brand prescriptions."
clueweb12-0000tw-00-00051,homemakersdaily.com,"Costos membership ranges from $55-$110 per year. The Gold Star membership is $55 and allows for 2 card holders, extra coupons mailed to you monthly, and the ability to purchase in-store and online. The Executive Gold Star membership is $110 and allows for 2 card holders, extra coupons in the mail, and 2% cash back on all purchases throughout the year. You will get a check at the end of the year for your percentage back. If the total does not equal $55, you can take your check in and they will refund the difference."
clueweb12-0000tw-00-00051,homemakersdaily.com,"Outside the normal expected goods at warehouses, they also have excellent competitive prices on prescriptions, tires, contact lenses, glasses and much more. Throughout the year you can find excellent prices on toys, books, clothing, Halloween costumes, movies and CDs, and specialty items."
clueweb12-0000tw-00-00051,homemakersdaily.com,Our family has a membership to Costco and we figured out that if we only bought milk there regularly we would pay for our membership 2.5x in a year with the amount we save!
clueweb12-0000tw-00-00051,homemakersdaily.com,"And now I want to tell you the secret to saving at warehouses. Are you listening very closely? Its all about what you buy and knowing your prices. Just because something is sold at a warehouse does NOT mean its a better deal than your neighborhood grocery store. You must look at the unit price to see if its a better deal. If you arent familiar with that term, unit price is figured by calculating the total price times the number of items the package contains. I often pull out my calculator and check unit prices while Im at Costco to compare it to what I know the grocery store price is to see if its a better deal."
clueweb12-0000tw-00-00051,homemakersdaily.com,"Some people hesitate to shop at warehouses because the quantities are often so large. If you have room in your pantry or freezer and your family will consume something in reasonable time, then it might be well worth it. Another way to get around the large quantity is going in with a friend to split the purchase. My sister-in-law and I have"
