key,host,payload
clueweb12-0000tw-00-00000,tsawer.net,annecy. france.
clueweb12-0000tw-00-00000,tsawer.net,xtWP Cumulus Flash tag cloud by Roy Tanck and Luke Morton requires Flash Player 9 or better.        
clueweb12-0000tw-00-00000,tsawer.net,No public Twitter messages.
clueweb12-0000tw-00-00001,tsawer.net,xtWP Cumulus Flash tag cloud by Roy Tanck and Luke Morton requires Flash Player 9 or better.        
clueweb12-0000tw-00-00001,tsawer.net,No public Twitter messages.
clueweb12-0000tw-00-00002,tsawer.net,xtWP Cumulus Flash tag cloud by Roy Tanck and Luke Morton requires Flash Player 9 or better.        
clueweb12-0000tw-00-00002,tsawer.net,No public Twitter messages.
clueweb12-0000tw-00-00003,tsawer.net,xtWP Cumulus Flash tag cloud by Roy Tanck and Luke Morton requires Flash Player 9 or better.        
clueweb12-0000tw-00-00003,tsawer.net,No public Twitter messages.
clueweb12-0000tw-00-00004,tsawer.net,xtWP Cumulus Flash tag cloud by Roy Tanck and Luke Morton requires Flash Player 9 or better.        
clueweb12-0000tw-00-00004,tsawer.net,No public Twitter messages.
clueweb12-0000tw-00-00006,thegoodlife.info,"        Someone once said: ""you can't get it right the first time"" and he was right. I did commit mistakes, some of which were costly, before I was able to publish my first electronic book. In this article, it's my aim to help you at least minimize those mistakes so you can make the whole thing manageable."
clueweb12-0000tw-00-00006,thegoodlife.info,        Read the rest of this Article Here...
clueweb12-0000tw-00-00007,claywginn.com,Whats in your back yard?
clueweb12-0000tw-00-00007,claywginn.com,"Im on vacation this week, so Im posting some older articles. Hope you enjoy this one."
clueweb12-0000tw-00-00007,claywginn.com,"You ever think about what is in your back yard? Might seem like a bit of an odd question, but its one thats been on my mind recently. Its really pretty easy for me to answer. Weve got a fort for the kids to play on, a slide and a little house for the younger ones, some lawn furniture, a grill, and a small patio. Seems pretty typical, doesnt it?"
clueweb12-0000tw-00-00007,claywginn.com,"Now, if I just stopped there, this would make for a pretty pointless and stupid post, so Im not going to. Whats interesting to me are the things that I didnt describe that are back there, things that I dont expect or want you to see. We have a new dog thats still a bit of a puppy and she likes to drag things out the dog door and into the backyard. She doesnt typically chew them up (except for shoes) she just takes them outside and deposits them between the fort and the back door. One day my wife and I were talking while I was driving home from work and she said, Dont look in the back yard when you get home. Naturally, I was curious why I was being restricted like this and she replied with, Because it looks like a diaper bomb went off out there. Apparently Maggie had found a trash can in the bedroom where we had been putting diapers and was taking them outside, one by one."
clueweb12-0000tw-00-00007,claywginn.com,"Now you might be wondering why Im telling you about this and how it relates to my point. You really need to be less like my son watching a movie, constantly asking about whats going to happen, and be more patient. Im only 250 words into this."
clueweb12-0000tw-00-00007,claywginn.com,"When there is stuff strewn all over the back yard, I hate going out there. Its surrounded by a fence so nobody sees it and this removes just about any motivation I might have to clean it up. I dont even like mowing out there. Normally, nobody knows about this except for my family and its not a big deal. However, last week, anyone driving by my house knew about my lack of back yard cleanliness. After a couple days of strong winds and one good storm, my already pathetic fence gave up on one side of the house and came crashing down. I look outside during the storm and notice three fence panels on the ground and two more waving like fans at a football game who just realized the camera was turned their direction. I was understandably disappointed that I would have to repair the fence, but I was more disturbed that now people would be able to see into my back yard and the sorry state it was in."
clueweb12-0000tw-00-00007,claywginn.com,"Last weekend while I was rebuilding the fence, I had plenty of time to think. I started to realize that the way we maintain our house could really be a metaphor for our own lives. I try to make sure that the front yard is fairly well kept, always mowed and looking at least presentable. The front yard is like my public life. Its lived out in front of anyone who can see it and what goes on there isnt hidden in the least. Any words I speak in public are out there for all to hear."
clueweb12-0000tw-00-00007,claywginn.com,"My back yard is a bit more guarded. I try to keep what is going on back there private, but it doesnt always work, as evidenced by my fence falling in. Just like that fence, sometimes my guard is down and people see a bit more of what Im really like. I might try to quickly build the fence back up but once someone sees that back yard of my personality, they probably wont forget it, especially if it contradicts what I normally do."
clueweb12-0000tw-00-00007,claywginn.com,"My point behind all this is that we need to be sure that what we display in the front yard of our lives, our public face, is consistent with how we live in the back yard of our life. We expect privacy there, but we should also understand that at any moment that privacy can be broken, and all the things that we try to hide from public view will be displayed for all to see. Luke 12:2-3 tells us:"
clueweb12-0000tw-00-00007,claywginn.com,"2 For there is nothing covered that will not be revealed, nor hidden that will not be known. 3 Therefore whatever you have spoken in the dark will be heard in the light, and what you have spoken in the ear in inner rooms will be proclaimed on the housetops."
clueweb12-0000tw-00-00007,claywginn.com,"Let us live our lives so that what is proclaimed from the housetops is our love for our Savior, our dedication to living our lives for the calling He has given to us. We are the light of the world, shining like that city on a hill to make known His sacrifice for us, not for our own glory, but for His. Pray that we do not let the hidden part of our lives become a hindrance to the spreading of His word."
clueweb12-0000tw-00-00007,claywginn.com,"Related Posts:What happens when you fail?Tebow (or, a shameless attempt at page views)The slippery slope of moralityFoundations: a week in reviewLost in the woodsPowered by Contextual Related Posts"
clueweb12-0000tw-00-00007,claywginn.com,  Did Collette tell you about the state of our backyard?  Hmm
clueweb12-0000tw-00-00007,claywginn.com,good post!
clueweb12-0000tw-00-00007,claywginn.com,"  Nope, didnt say a word. Im ashamed to say this all came from looking at ours."
clueweb12-0000tw-00-00007,claywginn.com,Thanks for the kind word!
clueweb12-0000tw-00-00007,claywginn.com,  This is awesome! Thanks for sharing!
clueweb12-0000tw-00-00007,claywginn.com,  Thanks Michelle!
clueweb12-0000tw-00-00007,claywginn.com,  Good stuff to ponder on Good Friday. Thanks!
clueweb12-0000tw-00-00007,claywginn.com,  Thanks Frank!
clueweb12-0000tw-00-00007,claywginn.com,Your email address will not be published. Required fields are marked *Name *
clueweb12-0000tw-00-00007,claywginn.com, Notify me of follow-up comments by email. Notify me of new posts by email.
clueweb12-0000tw-00-00007,claywginn.com,Subscribe to claywginn.com via email!
clueweb12-0000tw-00-00007,claywginn.com,Don't want to come check out the site every day? Subscribe here and I'll send you an email every time a new post goes up. Join 7 other subscribers
clueweb12-0000tw-00-00007,claywginn.com, Popular PostsWhat kind of God wants you to be poor and miserable? (33)Humble pride (33)Humble pride: a follow up (31)The beginning (20)Why do I write? (19)Starting over (18)Lost in the woods (18)Expectations (18)What is your mission? (18)What is bi-vocational ministry? (17) Categories
clueweb12-0000tw-00-00007,claywginn.com," Word Count StatisticsTotal: 21,977 WordsPosts: 21,458 Words (511 Avg.)   "
clueweb12-0000tw-00-00008,claywginn.com,The journey from your mind into your hands is shorter than youre thinking.
clueweb12-0000tw-00-00008,claywginn.com,"Be careful if you think you stand, you just might be sinking."
clueweb12-0000tw-00-00008,claywginn.com,"The hard thing about trying to be a good, moral person is that youre constantly being pulled towards those things you know you shouldnt be involved in. Temptation has a way of dragging you back onto the wide path when youve been trying to walk the straight and narrow."
clueweb12-0000tw-00-00008,claywginn.com,"Sometimes though, you make the choices yourself. You see that someone else is letting slide what you think is wrong, so you begin to think its OK too. It could be swearing, movies, drinking, just about anything. You start to feel pressure if youre the one that is different from everyone else and then you begin to conform to the ways of those around you."
clueweb12-0000tw-00-00008,claywginn.com,"And do not be conformed to this world, but be transformed by the renewing of your mind, that you may prove what is that good and acceptable and perfect will of God."
clueweb12-0000tw-00-00008,claywginn.com,"The little things add up, all the time. First, you decide to tell a little white lie so that you dont get in trouble. You follow those with lies to cover up the original lie. Years later, youre telling your spouse that youve been at the office all day when really youve been at a bar, all because its become more natural to lie than to tell the truth."
clueweb12-0000tw-00-00008,claywginn.com,"Opening the door to any sin allows all sin to get a foothold in your life. Weve got to battle back sin with the Holy Spirit, actively engaging in the fight and not passively allowing the enemy to roll over us. This is something that doesnt come natural to any of us, it really is a struggle to do. However, the reward for fighting back the sin in our lives is eternal."
clueweb12-0000tw-00-00008,claywginn.com,"Imagine that a worker notices a problem with a dam holding back millions of gallons of water. Below that dam is a quaint little town, full of people going about their everyday lives. If the worker notices a small leak in the dam, should he fix the leak, or should he just say, Oh, its just a small leak, it should be fine. Those millions of gallons of water are now placing pressure on that small leak, causing it to grow a little bigger with each passing day."
clueweb12-0000tw-00-00008,claywginn.com,"Gradually, the leak turns into a gaping hole, allowing more water to pass through, causing some minor issues in the little town. Still, the worker says, The dam is still standing, that hole isnt causing much damage. Ill ignore it."
clueweb12-0000tw-00-00008,claywginn.com,"Eventually, the gaping hole gives way to an actual dam break. Millions of gallons of water are rushing down the hill towards the little town, destroying everything in its path. The little town is destroyed, all the people are injured or killed, and the dam worker justifies it by saying, The dam just broke!"
clueweb12-0000tw-00-00008,claywginn.com,"Now, lets talk about sin this way. Maybe youve allowed a little sin into your life, but you dont want to deal with it because its not a big deal. Everyone has small issues, right? Your family doesnt know about it and everything looks normal. However, that sin is placing pressure on you and on the rest of your life, wanting to allow more sin to come through."
clueweb12-0000tw-00-00008,claywginn.com,"Gradually, that sin grows into something that you and your family notice, but you dont really identify the cause of the problem. You continue to justify it by saying that everyone is doing it, itll be OK. Its not causing too many problems in your life so you just let it continue."
clueweb12-0000tw-00-00008,claywginn.com,"Finally, the dam breaks. You act out on your sin in a big way, destroying your family, your reputation, and your relationship with God. You might say, I dont know what happened, I wasnt myself, it just happened!"
clueweb12-0000tw-00-00008,claywginn.com,"This is what happens when we allow sin to erode our life. Our familiarity with sin is unacceptable to God. We cannot be friendly with sin and friendly with God at the same time. Through prayer, through devotion to Him, God can give us the ability to overcome sin, but we have to make the effort to do so. We have to pursue God so that He can renew our minds."
clueweb12-0000tw-00-00008,claywginn.com,Are there areas where you need to battle back sin in your life? How can I pray for you?
clueweb12-0000tw-00-00008,claywginn.com,Related Posts:Humble pride: a follow upNaked ambitionBarely containableRuminatingWhats in your back yard?Powered by Contextual Related Posts
clueweb12-0000tw-00-00008,claywginn.com,Your email address will not be published. Required fields are marked *Name *
clueweb12-0000tw-00-00008,claywginn.com, Notify me of follow-up comments by email. Notify me of new posts by email.
clueweb12-0000tw-00-00008,claywginn.com,Subscribe to claywginn.com via email!
clueweb12-0000tw-00-00008,claywginn.com,Don't want to come check out the site every day? Subscribe here and I'll send you an email every time a new post goes up. Join 7 other subscribers
clueweb12-0000tw-00-00008,claywginn.com, Popular PostsWhat kind of God wants you to be poor and miserable? (33)Humble pride (33)Humble pride: a follow up (31)The beginning (20)Why do I write? (19)Starting over (18)Lost in the woods (18)Expectations (18)What is your mission? (18)What is bi-vocational ministry? (17) Categories
clueweb12-0000tw-00-00008,claywginn.com," Word Count StatisticsTotal: 21,977 WordsPosts: 21,458 Words (511 Avg.)   "
clueweb12-0000tw-00-00009,claywginn.com,"Its been quite a week. We have one more night here at Walt Disney World, then we are headed home. Ill give you a bit of a preview for next week though. There are a few things Ive noticed here that develop into great analogies for life lessons. Anything from a large, burly fellow with a pink Disney Princess backpack, to using the bathroom at the dinner table, to the lack of wisdom in crowds. I think youll enjoy these. "
clueweb12-0000tw-00-00009,claywginn.com,"However, today Id like to share with a you a few lessons that have been forcefully taught to me this week. Some painful, some really painful, and some rather enjoyable."
clueweb12-0000tw-00-00009,claywginn.com,"I love that Ive been able to spend a week in a single hotel room with my wife and kids. However, Im going crazy spending a week in a single hotel room with my kids. Bedtime is the absolute craziest time of day. I dont know if it is the tired children, the tired parents, or the insanity of being in one room, but little ones do not go to sleep well this way, at least not ours. Now, this is a very first world problem, and I know that I should be thankful that Im able to take trips like this with my children. Dont misunderstand me, because I am very thankful for that. The simple fact remains that it is so far out of the ordinary for us as to be uncomfortable and even more tiring."
clueweb12-0000tw-00-00009,claywginn.com,"The second thing Ive learned is that you can tell how many days people have been here just by the look on their faces. There is an unspoken Ive sat through ;Its A Small World so many times that i might just twist off at the next puppet I see look to some faces. These are the people that are not hardcore Disney fans, but came mostly for their children. (An aside: you know what would make Small World so much better? Bucket o softballs. Youll have to create a queue that would stretch all the way across the park for it. So many childhood doll nightmares erased in a hail of tossed balls. Its a goldmine. I expect my royalty checks to pour in soon.)"
clueweb12-0000tw-00-00009,claywginn.com,"Too many people come here with the expectation that they can accomplish everything at WDW in a week. This is so far from the truth. My wife and I have been coming here since 1996, and weve still not seen or done it all. The likelihood is pretty slim that it will happen too. Too many things changing or disappearing to be able to conquer that mountain. "
clueweb12-0000tw-00-00009,claywginn.com,"The one lasting memory I have from our trips to WDW is the sense of awe that my children feel. Heck, I feel it too. Everything here is so much bigger, so much more perfect than the real world. Of course, if it werent that way, we wouldnt be paying to visit. If someone built a Computer Progeammer World, Id have to be drugged to be taken in to it. I dont want my real life, I want a different reality. That might be good sometimes, but it definitely isnt a way to live. "
clueweb12-0000tw-00-00009,claywginn.com,"Finally, it appears to me that while they are here, people become a clearer, more exact picture of themselves due to the money and time spent, and emotional and physical investment paid to be here. Vacations, especially big ones like WDW have a way of refining our personalities in a way that other experiences dont. Ive seen adults act like complete children and complete jerks. Ive seen children be perfect angels and ceaseless terrors (and you should have seen everyone elses kids, too). Im sure that I exhibit some of this too. We are who we are, and exhaustion makes the pretensions go away. "
clueweb12-0000tw-00-00009,claywginn.com,"All in all, its been a great time here. Im anxious to start home and return to my own reality though. Too many exciting things coming up in the next few weeks that I dont want to miss. I hope you come back again next week for my Observations on the World series."
clueweb12-0000tw-00-00009,claywginn.com,Related Posts:Next years modelFlummoxed: a week in reviewWhat is bi-vocational ministry?Whats in your back yard?Where to go from herePowered by Contextual Related Posts
clueweb12-0000tw-00-00009,claywginn.com,Your email address will not be published. Required fields are marked *Name *
clueweb12-0000tw-00-00009,claywginn.com, Notify me of follow-up comments by email. Notify me of new posts by email.
clueweb12-0000tw-00-00009,claywginn.com,Subscribe to claywginn.com via email!
clueweb12-0000tw-00-00009,claywginn.com,Don't want to come check out the site every day? Subscribe here and I'll send you an email every time a new post goes up. Join 7 other subscribers
clueweb12-0000tw-00-00009,claywginn.com, Popular PostsWhat kind of God wants you to be poor and miserable? (33)Humble pride (33)Humble pride: a follow up (31)The beginning (20)Why do I write? (19)Starting over (18)Lost in the woods (18)Expectations (18)What is your mission? (18)What is bi-vocational ministry? (17) Categories
clueweb12-0000tw-00-00009,claywginn.com," Word Count StatisticsTotal: 21,977 WordsPosts: 21,458 Words (511 Avg.)   "
clueweb12-0000tw-00-00012,talkingwalls.ca,Your cart is empty.
clueweb12-0000tw-00-00012,talkingwalls.ca,DISCOUNTS!!
clueweb12-0000tw-00-00012,talkingwalls.ca,Doggie Paws$3.00
clueweb12-0000tw-00-00012,talkingwalls.ca,What did you think?
clueweb12-0000tw-00-00012,talkingwalls.ca,"We can all twinkleFrancine, this quote has made my sitting room complete! It feels...Read More ->View All CommentsAdd your thoughts.."
clueweb12-0000tw-00-00012,talkingwalls.ca,$3.00
clueweb12-0000tw-00-00012,talkingwalls.ca,   approx. 4x3.5 in
clueweb12-0000tw-00-00012,talkingwalls.ca,How Many?
clueweb12-0000tw-00-00012,talkingwalls.ca,  2 ( +$3.00 )
clueweb12-0000tw-00-00012,talkingwalls.ca,  3 ( +$6.00 )
clueweb12-0000tw-00-00012,talkingwalls.ca,  4 ( +$9.00 )
clueweb12-0000tw-00-00012,talkingwalls.ca,  5 ( +$12.00 )
clueweb12-0000tw-00-00012,talkingwalls.ca,Comments? Commentaire?
clueweb12-0000tw-00-00012,talkingwalls.ca,Dogs are natural born thieves...$25.00
clueweb12-0000tw-00-00012,talkingwalls.ca,Copyright  2012 TALKING WALLS. Powered by Zen Cart
clueweb12-0000tw-00-00013,cheapcosthealthinsurance.com,What is hiv aids HIV-AIDS has been lurid to populace all over the globe. What is hiv aids youthful populace are the mainly susceptible to this illness. What is hiv aids More and more juvenile populace die each next as of the illness. What is hiv aids More and more juvenile populace are impure daily 
clueweb12-0000tw-00-00013,cheapcosthealthinsurance.com,during some of the four behavior. What is hiv aids during which one can contact the disease. What is hiv aids you dont identify the four ways? I will tell you. What is hiv aids my anxiety here is that there is really amazing that slays earlier than HIV-AIDS. What is hiv aids there is amazing that murders sooner .than the lethal HIV-AIDS.
clueweb12-0000tw-00-00013,cheapcosthealthinsurance.com,What is hiv aids HIV is the totally lethal germ that reasons AIDS. What is hiv aids In case you dont identify or you recognize but maybe youve overlooked. What is hiv aids HIV is the ellipsis for Human Immunodeficiency Virus.
clueweb12-0000tw-00-00013,cheapcosthealthinsurance.com,What is hiv aids HIV AIDS is an short form for Acquired Immune Deficiency Syndrome. What is hiv aids It is the result of life form assault by HIV. What is hiv aids The assignment of HIV is to obliterate the human immune system. What is hiv aids therefore makes chance for a variety of infection recognized as opportunistic infections to assault the fatality.
clueweb12-0000tw-00-00013,cheapcosthealthinsurance.com,"What is hiv aids The opportunistic disease comprise some lethal illness. What is hiv aids you can believe of such as diabetes, kidney failure. What is hiv aids it damages heart disease, tuberculosis, consumption chaos and liver illness. What is hiv aids The disease comprise all the main health evils on soil. What is hiv aids as the resistant structure is now dysfunctional  what is hiv aids it rejection longer defend the cadaver starting lethal stranger."
clueweb12-0000tw-00-00013,cheapcosthealthinsurance.com,"What is hiv aids I tell you about the four conduct during which one canister contact HIV-AIDS. What is hiv aids They comprise sexual contact amid impure person. What is hiv aids furthermore a new person, distribution of unsterilized pointed. What is hiv aids tools, blood transfusion, and mother-to-child transmission. What is hiv aids, its sensible youthful people desist from some form of sexual connection. What is hiv aids wedded people are recommended to be true to their allies. What is hiv aids as having a lot of buddies can actually create one vulnerable to the illness."
clueweb12-0000tw-00-00013,cheapcosthealthinsurance.com,                                                    Be the first to comment - What do you think? 
clueweb12-0000tw-00-00013,cheapcosthealthinsurance.com,WordPress Theme by HeatMapTheme.com
clueweb12-0000tw-00-00014,cheapcosthealthinsurance.com,"HIV or AIDS are debatably the mainly famous and mainly dread STDs of nowadays. HIV or AIDS, which are better clear as Acquired Immune Deficiency Syndrome, are a grave shape of sexually HIV or AIDS broadcast illness that assault and fail the immune system. HIV or AIDS foliage the cadaver susceptible to illness that would guide HIV or AIDS wounded to deadly cost."
clueweb12-0000tw-00-00014,cheapcosthealthinsurance.com,"HIV or AIDS are a kind of immunodeficiency disarray where a bit of the mechanism of the resistant organization befalls absent. HIV or AIDS is the last stage of series of the illness HIV or AIDS have resulted from a viral disease recognized as Human Immunodeficiency Virus (HIV or AIDS virus). HIV or AIDS These illness transport down several harsh and strange disease, HIV or AIDS debilitating illness, and several additional situation HIV or AIDS influence the middle anxious organization and the brain. HIV or AIDS Opportunistic disease affects approximately each limb scheme of people pain from AIDS. HIV or AIDS also augments the danger of rising sure cancer, HIV or AIDS such as cervical cancers, Kaposis growth and lymphomas."
clueweb12-0000tw-00-00014,cheapcosthealthinsurance.com,"HIV or AIDS patients expand dissimilar opportunistic disease depending on HIV or AIDS extensive such infections are on the region where the enduring is located. The HIV or AIDS virus leftovers in ones corpse everlastingly and might stay hidden for some months HIV or AIDS existence unless indication of AIDS or HIV emerge. HIV or AIDS As moment development for several existence and still decades, HIV or AIDS chamber in the immune systems befalls slowly smashed HIV or AIDS would go the body unguarded beside these opportunistic diseases. HIV or AIDS These parasites, viruses and cancer cells will increase inside HIV or AIDS a victims body heavily unconcealed. The characteristic HIV or AIDS opportunistic disease that struck the body of HIV or AIDS wounded are tuberculosis, HIV or AIDS yeast infection in vagina, throat, or mouth, pneumocystis cariniipneumonia, HIV or AIDS cytomegalovirus retinitis and shingles."
clueweb12-0000tw-00-00014,cheapcosthealthinsurance.com,"HIV or AIDS indications are mainly the belongings of circumstances HIV or AIDS usually dont obviouses on populace having healthy immune systems. HIV or AIDS frequently era these are universal indications of an disease, HIV or AIDS such as heavy worries mostly throughout night time, HIV or AIDS fevers, chills, swollen glands, weaknesses and loss of weight."
clueweb12-0000tw-00-00014,cheapcosthealthinsurance.com,                                                    Be the first to comment - What do you think? 
clueweb12-0000tw-00-00014,cheapcosthealthinsurance.com,WordPress Theme by HeatMapTheme.com
